{
  "contract_version": "vcs-agent/v1",
  "binary_version": "0.1.0",
  "operation": "inspect",
  "status": "success",
  "data": {
    "repository": {
      "backend": "git",
      "root": {"display": "[REDACTED_PATH]", "encoding": "redacted", "value": null},
      "cwd": {"display": "[REDACTED_PATH]", "encoding": "redacted", "value": null}
    },
    "working_copy": {
      "branch_kind": "branch",
      "branch": "main",
      "revision": "0123456789abcdef",
      "change_id": null,
      "dirty": true,
      "tracked_changes": 1,
      "untracked": 0,
      "total_changes": 1,
      "conflicted": false,
      "conflict_count": 0,
      "operation": "clear",
      "upstream": {"branch": "origin/main", "ahead": 0, "behind": 0}
    },
    "remotes": [{"name": "origin", "url": "https://example.invalid/owner/repo"}],
    "forge": {
      "detection": "detected",
      "kind": "unknown",
      "remote": "https://example.invalid/owner/repo",
      "capabilities": {
        "status": "known",
        "reason": null,
        "value": {
          "cli_version": null,
          "cli_supported": false,
          "authenticated": false,
          "pr_create": false,
          "pr_comment": false,
          "pr_edit": false,
          "pr_labels": false,
          "pr_checks": false,
          "pr_merge": false,
          "pr_approve": false,
          "pr_request_changes": false,
          "issue_create": false,
          "issue_close": false,
          "issue_reopen": false,
          "issue_comment": false,
          "issue_labels": false,
          "release_create": false,
          "release_delete": false
        }
      },
      "auth": {
        "status": "known",
        "reason": null,
        "value": {
          "authenticated": null,
          "active_account": null,
          "accounts": [],
          "repository_visible": null
        }
      }
    },
    "capabilities": {
      "inspect": true,
      "changes_summary": true,
      "changes_full": true,
      "lossless_status_paths": true,
      "full_diff_non_utf8_paths": "git-lossless-jj-text-limited",
      "raw_cli_fallback": false
    },
    "read_semantics": {
      "refs_mutated": false,
      "index_mutated": false,
      "working_copy_content_mutated": false,
      "working_copy_snapshot": "none",
      "operation_log_may_advance": false
    }
  },
  "error": null,
  "warnings": [],
  "fallback": null
}
