{
  "contract_version": "vcs-agent/v1",
  "binary_version": "0.1.0",
  "operation": "publish",
  "status": "success",
  "data": {
    "repository": {
      "backend": "git",
      "root": {"display": "[REDACTED_PATH]", "encoding": "redacted", "value": null},
      "cwd": {"display": "[REDACTED_PATH]", "encoding": "redacted", "value": null}
    },
    "expected_revision": "0123456789abcdef0123456789abcdef01234567",
    "remote_revision": "0123456789abcdef0123456789abcdef01234567",
    "remote": "origin",
    "source": "feature/checked-publish",
    "target": "main",
    "forge": "github",
    "account": "agent",
    "push": {"state": "already_satisfied", "irreversible": true, "verified": true},
    "change_request": {
      "state": "already_satisfied",
      "number": 42,
      "url": "https://example.invalid/pull/42",
      "source": "feature/checked-publish",
      "target": "main"
    },
    "checkpoint": "publish_complete",
    "exact_revision_verified": true
  },
  "error": null,
  "warnings": [],
  "fallback": null
}
