{
  "contract_version": "vcs-agent/v1",
  "binary_version": "0.1.0",
  "operation": "ci_wait",
  "status": "success",
  "data": {
    "repository": {
      "backend": "git",
      "root": {"display": "[REDACTED_PATH]", "encoding": "redacted", "value": null},
      "cwd": {"display": "[REDACTED_PATH]", "encoding": "redacted", "value": null}
    },
    "forge": "github",
    "source": "feature/checked-publish",
    "expected_revision": "0123456789abcdef0123456789abcdef01234567",
    "exact_revision_verified": true,
    "terminal": true,
    "successful": true,
    "runs": [
      {
        "id": 100,
        "workflow": "CI",
        "revision": "0123456789abcdef0123456789abcdef01234567",
        "status": "completed",
        "conclusion": "success",
        "url": "https://example.invalid/actions/runs/100"
      }
    ],
    "wait": {
      "total_deadline_seconds": 1800,
      "poll_seconds": 10,
      "inactivity_watchdog": "github-run-watch-300s",
      "diagnostic_budget": "processkit-drop-oldest-256KiB-256-lines"
    }
  },
  "error": null,
  "warnings": [],
  "fallback": null
}
